job_title,company_name,company_location,job_link,match_score,job_description
Senior Full-Stack Web Developer,Not available,Not available,https://www.indeed.com/pagead/clk?mo=r&ad=-6NYlbfkN0CSkun2EgXra_RWbvkJ6mKWarAKITizR7kXrCRlYdrNeX_6LTXkGmRxX-DbvR9LW0PKLnIyc8HqY28Lb_K5f8Nxk4aQ_3prSLvfOwYfKITWwg1iDwaycgwIQYgmOi047nwLOMkCZ56QnvziqA84mgVq32Ybe9E_NWK9JB-Blp45OP7MQCRhLUd23PAF2winzgi_Kv2bx8ygxr8ZnEGWjlmhvJILskMFjBXEuIBvpwZaF19a-F1BCzt3EVtjHySxS1M6jPLWmc5lB0PuUgz5p1mm0a7Ujq4DUT4KZ1FHEvntv7Uftj4IBgBfe6oNCyzAMZMb6VP2NEqcsDMKrf10HOcVbhTUQxVWtNAbIM3MEF9uKRtDc6L5dd_10r4UuXKBSVaYuhjSDQBrXbyBZ2X6ynBlVZLKHdWPkLkXgZKzjilJgsCw34Bz6FOvUYCkyKzWpGNfDSvL2bzxZno1Tmjo99FtYDwj9S0vZysTyLYA_iHFVTtdcuWSUanMJEJv5yOACLi9cEZgLnQKWGy3KWyzCJ5rS2XJu0vng9Yjde-KQbIqfg6-d7sa2VaGGjcat8Brsvu3PjKH-K99BaXorBtpwQvBrbzUXl7v9pK-9TGBGanJmtDBgNNbp1WQLacpsBIXAgY=&xkcb=SoDj6_M3q9qcjzygDZ0SbzkdCdPP&camk=ethIe0s0hefUNEQKSQTbYA==&p=0&fvj=0&vjs=3,,"About this position SeeScan is seeking a Senior Full-Stack Web Developer to develop the end-customer product for our online utility mapping platform. As the onsite representative of a technical team, you will be the primary connection between the customer vision and implementation. Compensation The salary range for our Senior Full-Stack Web Developer position is $145,000 to $180,000 annually. This range represents a good-faith estimate based on the qualifications we expect to find in a successful candidate. Actual compensation offered may be less or greater than this estimate based on a variety of factors, including, but not limited to, our assessment of your ability to bring value to our organization. We offer A position within an established company that has over 40 years of experience Medical, dental, and vision coverage Traditional and Roth 401(k) investment options, with partial company matching contribution Flexible Paid Time Off plan with no cap or “use it or lose it” requirement In your application, include your resume and a thoughtful cover letter explaining why you are the ideal candidate for this position. We are looking for a long-term, in-house teammate to join us, not a contractor or consultant. In this position, you will Use your web development expertise to translate customer needs and product vision into clear technical requirements Collaborate with remote developers to ensure seamless implementation and delivery Develop a robust, scalable, and maintainable web application by calling on your experience in a variety of web frontend and backend technologies About you Able to work independently onsite while coordinating effectively with remote coworkers Clear thinker with strong problem-solving skills and a product-focused mindset Flexible and comfortable working with shifting priorities and moving targets Your background Expert in Angular, Typescript, and Python Comfortable using version control systems, including Git 5+ years’ hands-on experience in a full-stack web development role About SeeScan Modern life depends on the infrastructure that brings water, electricity, gas, and communications services to our homes and businesses. SeeScan’s mission is to deliver the highest quality products that protect these vital services. We are an original equipment manufacturer in San Diego, CA that builds diagnostic and utility locating equipment from the ground up, from initial product conception to prototyping, testing, and final assembly. At SeeScan, you’ll be part of a group of people who bring passion and energy into everything they do. We value the individual contributions all of our employees make and invest in the tools and training they need to find success and professional growth. We do our best to empower the right people to take on new opportunities, and our culture promotes transparency, integrity, and continuous learning. Notes No recruiters, contractors, or consultants, please No relocation assistance or visa sponsorships available for this position SeeScan is an Equal Opportunity Employer Job Type: Full-time Pay: $145,000.00 - $180,000.00 per year Benefits: 401(k) 401(k) matching Dental insurance Employee assistance program Flexible schedule Flexible spending account Health insurance Health savings account Life insurance Paid time off Vision insurance Work Location: In person"
Senior Full-Stack Engineer,Not available,Not available,https://www.indeed.com/pagead/clk?mo=r&ad=-6NYlbfkN0DQ6UeBurswhMmzg_0Uro9PIfT71DsQglHA5GFhKL2jSBKyFSdoI7OCC6T9ThODtc1RE3swwRpGz1i56pZ-P19-n6_XjzXl1RCSsTfPI-2V9N0YFtm8rSxDwMkymF2j3JltHWRZcTFpf5uaNlFYZw3qglMmlvEbnQytGaSZYwRzFIuz1p2w-X82WhJJfr_abdFFTHVH7z5dhRylAEaVSz_2UcXyHKdEhKtg0D9sOxo-MgjjL6JYFmJo8Rrp14PLmbGW-E72wepBktQzsLulnm8O2lWB7P-M-_r97tlf2TXXC68WMzK1Ex-P-la6Y33BA78QC03K2TlHIjEdlOM0D3xOvNT8BY3u6Hp57HVpPmam-TYd-XSE9McIcvnCwDpoPoWKARXLyT4-atlewNVnPkMrj62wgcjPUUnlo2jIn4h3EdjLLfomlinEnKnIhRLLKipBIYqtYhF0kvqE3fefdrB8CQCwcs0X6dCy-Xdpjdqo4JAsVHja6tXk4wOW_MkNixY1h1Uqw1tDJxgc1-kuJT1ZWUCkWDx2Tb8ABKUZH6p97D936Vl8_5m39l8mV4Tb2x0ZSNTQ8Ozp5Vw7WVjPCo8_2jz9TYw0Q38=&xkcb=SoB-6_M3q9qcjzygDZ0RbzkdCdPP&camk=UoKtGZLa3XIrsxnNU8jgrA==&p=1&fvj=0&vjs=3,,"Be a part of Gallup's e-commerce evolution and growth strategy. Gallup is adding an experienced full-stack web engineer to support our new e-commerce platform and migration. Ideal applicants will have experience building high-traffic public websites, customizing solutions to meet unique business needs, building multiple integrations, and delivering a simple and elegant digital experience. What You'll Do Implement e-commerce features such as product catalogs, storefronts and checkout processes Integrate with third-party systems (e.g., payment gateways, AWS) Use proofs of concept (spike solutions) to validate cost/time estimates, identify risks, and confirm business value and usability of new features Collaborate with cross-functional teams to deliver end-to-end solutions Troubleshoot, test and optimize system performance What Makes You Stand Out Broad engineering experience: You have the experience and aptitude to work across many systems, platforms and languages. Leadership in major initiatives: You are known for your expertise in launching successful web projects. Innovative problem-solving: You have a proven track record of developing software platforms through multiple iterations, new features and customizations. Early-stage company experience: Whether at a startup or during an intense period of product development, you gravitate toward roles with great opportunities and big impact. What You Need Bachelor's degree in computer science, MIS or a related field or equivalent experience required At least five years of experience in one or more back-end languages such as Java, C#, Python, Ruby or Node.js required At least five years of experience with modern JavaScript/TypeScript and semantic HTML required At least three years of experience with cloud platforms is required, with a strong preference for AWS services such as S3, Lambda, and SNS/SQS At least three years of experience with CI/CD solutions such as Jenkins, GitHub Actions or Azure DevOps required At least three years of experience with RDS (Mysql or SQL generally) required At least three years of experience in a high-velocity growth or product-led team environment required Proven experience working in a senior engineer capacity required Demonstrated ability in mentoring junior engineers preferred Professional experience with B2B e-commerce preferred Salesforce Commerce Cloud experience (Apex, Flows, Actions, Lightning Web Components) preferred Experience with data lakehouse, MarTech, DTC, ADS toolchain, BI toolchain or user experimentation a plus Must live within a 60-mile radius of San Francisco A commitment to working on-site at a local Gallup workspace in San Francisco at least three days a week required What You'll Experience Mission-driven work: Make a meaningful difference for organizations, governments and individuals with your unique contributions, commitment to service and exceptional outcomes. Engaged teams: Join world-class managers, highly productive colleagues and knowledgeable mentors who are enthusiastic about their work. Learning opportunities: Focus on continuous growth by developing your strengths, feeding your curiosity, challenging conventional thinking and experimenting. Brand strength, startup energy: Thrive in an innovative culture backed by a trusted brand. A collaborative environment: Work where your ideas, perspectives and experiences are welcome and valued. Learn more about life at Gallup . Gallup offers a robust benefits package that includes medical, dental, vision, life and other insurance options; a fully vested 401(k) retirement savings plan with company matching; an employee stock ownership program; mass transit reimbursement; family-building benefits; an employee assistance program; and various reimbursements and activities that enhance our associates' wellbeing. We also offer an estimated annual salary range of $180,000-$230,000 for this role. Salaries are based on a variety of factors, including an individual's education, experience and skills. Gallup is an equal opportunity employer. We consider all qualified applicants without regard to race, color, religion, sex, national origin, disability, protected veteran status, sexual orientation, gender identity, or any other legally protected basis, in accordance with applicable law. To review Gallup's Privacy Statement, please click this link: https://www.gallup.com/privacy. This privacy policy is meant to help you understand what information we collect, why we collect it, and how you can update, manage and delete your information. Your application and the information you provide will be processed and stored in the United States."
Senior Full-Stack Engineer,Not available,Not available,https://www.indeed.com/viewjob?jk=f1e2d3c4b5a67890,,Full Description Failed to Load (Blocked)
Junior Full Stack Software Developer,Not available,Not available,https://www.indeed.com/pagead/clk?mo=r&ad=-6NYlbfkN0CxvcZdhReYs4yXJrk6MNozk4A69S-M2IjXSJE--p5P6RWxPvPSVz6OMKeed3dBwmWOHy8FCi9YZCSCu2BAV9gjve8lmhC1dIKP7RiXL4DwoQG7GJoFCnmnuez3_OVEcdtusVh_LXA4kKDNAQgDz4gYhmhZb7HByDrZZfMF5a5e6JWCEMl9uiZ3czP7KmKJBoUpqsYrSuOTDQUnZgZgKyad4Z2o_fwrdGT6mKF8q_cd6KrnrRpCbv4-Avc33UxpyZaTtJ8xqbqGgHGYPRyqpLdas-RcAr-lX2ccuJE-sGk9v3iwHQI7sv0JnzTXOvvHX-GLqPLGJgs2onYMUO57Uw11wFTonVB4JuW94k0jxeIgd8e7ucHc_O2B4XoVsvOoWQ3RA6G2t748up_p-cRpedPgkMyEoE2UDPd6nK1fZWoLxncV4ULhmzMtquxqLCU75sA8s8SIAk34p6QybCtAufzY_KNekvMn14zeyGOC3i-4v8C2WcNIx7xqKdEkJY0iCqcqvCzYwrZLdKzNQ8t2pobRYzJJszNArLQfZsNrXDRNnAnlHLOraI3r89CrxPd0-zJmsmC2Q8dmMQnqE-ieJTxx_mPwegFyW04XFhJ_XEP_y4pZqNv3Gp3yU3sSWtM7QtjpTr_WfKQ8i54PLOXYl0l96m97grPPppnivrAoB9gMfEH4rcaS0f25GgVyd2F_cF2g0_2TBMnRfe2GbwycC5jz&xkcb=SoDK6_M3q9qcjzygDZ0QbzkdCdPP&camk=UoKtGZLa3XLUcQcKSoI2FA==&p=2&fvj=0&vjs=3,,"The Western Mutual Insurance Group has been providing excellent customer service to homeowners throughout the Southwestern United States for over 80 years. We are rated A (Excellent) by A.M. Best Company and have been named among the Top 50 Property Casualty Insurers in the country by Ward’s. Our constant endeavor in employee relations is to maintain a well-trained, enthusiastic, and efficient group of employees who work together to make our business successful, thus enhancing the career goals of every employee. We are seeking a motivated and detail-oriented Junior Full Stack Software Developer to join our team as a full-time employee. The ideal candidate will demonstrate a strong foundation in software development principles, a willingness to learn new technologies, and the ability to work effectively within a collaborative, agile environment. This position provides an excellent opportunity for professional growth and hands-on experience in the full software development lifecycle — from design and development to testing and deployment — while contributing to meaningful projects that support our organization’s strategic objectives. Responsibilities · Assist in the design, development, and maintenance of enterprise-level web applications. · Write clean, efficient, and maintainable code following established coding standards and best practices. · Support the testing, troubleshooting, and debugging of application features and enhancements. · Collaborate with senior developers and cross-functional teams to deliver project objectives within defined timelines. · Participate in code reviews, technical discussions, and agile sprint activities. · Maintain documentation for assigned development work and contribute to process improvement initiatives. Job Requirements · Proven experience (2+ Years) as a Full Stack Developer with a focus on C# and JavaScript · Experience with one or more front-end tools such as ASP.NET, Razor Pages, Vue and ReactJS · Familiarity with modern web frameworks (e.g., ASP.NET Core). · Experience with writing effective APIs. · Knowledge of TDD methodologies and SOLID principles. · Experience with database systems (SQL Server, NoSQL, etc.) · Take ownership and pride in your work The preferred applicant will possess the following skill set: · Familiarity with ASP.NET Core and API development. · Exposure to cloud platforms such as Microsoft Azure or AWS . · Experience with version control systems (e.g., Git) and agile methodologies. · Experience in the Insurance , Finance , or E-commerce industries. We offer a competitive salary and a full benefits package including, 401k Plan, Profit Sharing Plan and Bonus Plan. Please see our Privacy Notice For Job Applicants here:https://www.westernmutual.com/careers/privacynoticeforjobapplicants Job Type: Full-time Pay: $100,000.00 - $120,000.00 per year Benefits: 401(k) AD&D insurance Dental insurance Health insurance Life insurance Paid holidays Paid time off Work Location: In person"
"Full Stack .NET, C# Application Developer",Not available,Not available,https://www.indeed.com/pagead/clk?mo=r&ad=-6NYlbfkN0AAw7XZKARL-tp7vJahGpKVToJ81VOgdpjnBREYWFcfB-6ZmnYX-zgBM1xoX5YiyONiXoeTHOwOjnnBQuHD_yYtXDe0tyELt43zqggUEZTqxtSRcyrJ_H6p2xsEx1bFBck_52uhVm5QLHc9iCYNTxDvAe8cQUXcDhDOvkV4uteu6Z6I0Ekod4LGWoWHfuMJs_1tbeqecqBTHnMeDEaUy2KP_4y0W9pPXPlpADC1MGOiiXLvtX_kG2tAnTXkFO0LLjymHAu1PAcdqYU4J6krrliqd9bsILPHp4yP-kkhQZbRGHzj1mAKNVF7kxHzDRgU289yxTGIjt9HU-RxBL-IcF6o-E2FGHpKpvxi5wcinqGP3GOYnB4Lz1sZD5sOe926R147Kg3CliOjKbeishuGKv_cf2JUuTW_KdfWaLGUYoNrnVU54ykvZpK4xKQ3NEdJdi6VWKVDu-PSYo3dJJVJpdw4z52U6LgLDG25USHV3ngpr_OAdU44Pu0zd1FxFHVbnSdZVMCz70fIygpl0gva3MjfpzuuPgzusAExsWxG6MA1cnRJx1qR27imNxP6L_Kquu5PlA2jrL_PfdaQWjhPdbxhHDl_GE76O5R8UYx3zHurNLhLNsEyKxO4cCLV3DwJrWXh1J4ufIpkbYDjBS8kWUHmLwTf0FS8Eew=&xkcb=SoBE6_M3q9qcjzygDZ0XbzkdCdPP&camk=dUNjXzWXzoDSZ5_VSW0GxA==&p=3&fvj=0&vjs=3,,"Overview We have staffed one with this client and need 2 more – GREAT client – growing rapidly REQUIRES: US Citizen or Permanent Resident Green Card and currently live within 45 minutes from work location. This job requires 100% onsite daily – no exceptions FOCUS IS ON: REST APIs Event driven architecture API Management PLEASE PROVIDE ANSWERS TO BOTH SETS OF QUESTIONS – You can use the comments section and follow up with Di@DKKDstaffing.com and DawnWilson@DKKDstaffing.com NO REMOTE – 100% ONSITE – NO exceptions CLIENT WON’T ACCEPT RELOCATION TITLE: Full Stack .NET/C# Application Developer Location: Valencia (Santa Clarita), CA, 91355 NOTE: Must already live locally or have family or friends who live within 30 minutes of Valencia, Ca REPORTS TO: IT Development Manager SALARY RANGE: $125K-$145K What we are looking for: DKKD Staffing is looking for another Full Stack .Net/C# Developer for our Valencia, CA 91355 client. We have staffed many people at this company and 2 other people in this department. Under the supervision of the IT Development Manager, we are looking for a FullStack .NET/C# Application Developer designs, develops, implements, modifies, and supports software applications and components for core business processes. Works from written specifications and pre-established guidelines to perform the functions of the position while maintaining technical documentation of process flow associated with their work. The focus is REST APIs Event driven architecture: API Management: Please complete both the Application & Job Specific questions below. Part 1 APPLICATION QUESTIONS (Please answer all questions) Legal Name & Preferred Name or Nickname: Best Contact Info (Cell & email): Your Linked In: Why looking for a new job: Availability for interviews and a new job: Where do you live (City, State, Zip): Desired geographical work location: Are you open to 100% onsite, hybrid and/or remote: Are you open to relocation if required: Are you open to travel if needed and have an active passport if needed: Are you authorized to work in US (Please indicate US, Green Card or Other): Hourly/Salary Expectations: (We need a range) $ Sizes of staff managed and their titles (include # of direct reports): Budgetary Responsibility: $ Education/Certs/Degrees (also indicate which certs are active): Who Referred You/ How Did You Hear About Job/ DKKD Staffing: Part 2 Job Specific Q&A – please supply answers to the questions above and these as well. Please provide total years of experience, last used and any specific elaboration that might help you get an interview Five to seven (5-7) years relevant programming experience, undergraduate degree in computer science, business or equivalent combination of education and experience: Proficiency in .NET/C# development (+5 years): .NET/C# full stack developer experience (+3 years): ASP.NET, SQL Server, RabbitMQ,: REST APIs: Event driven architecture: API Management: Strong front end experience with JavaScript, jQuery, HTML, CSS: Designs, codes and tests new Windows and web software applications: Proficient understanding of code versioning tools such as Git, GitHub, SVN, other tools for Agile SCRUM Sprint scheduling and issue tracking such as Atlassian JIRA and Confluence. Nice to have Q&A: MS Azure Solutions Architect and Developer: Microservices (using Azure Functions, Docker, or Kubernetes): Azure API Management: Azure Logic Apps: Azure Event Grid: Azure Service Bus: CI/CD Azure DevOps or GitHub Actions: Infrastructure as Code tools (Terraform, Azure Bicep): Describe a situation where you had to solve an issue for your employer: JOB RESPONSIBILITIES: Under general supervision implements all aspects of an application design – high performance design, coding, caching mechanisms, security, encryption, state management, error logging, debugging, scalability, code reviews, development environment configuration, and testing. Participates in every aspect of the development and implementation, working with project analysts to ensure full understanding of the change implications to business processes. Confirms application meets specifications through objective review process. Ensures the best possible performance, quality, and responsiveness of applications. Identifies bottlenecks and bugs, log issues and recommend solutions to identified issues. Helps maintain code quality, organization, and automatization. Performs unit and system level testing on applications. Develops data migration and integration processes to legacy systems using identified development tools and technologies. QUALIFICATIONS: Five to seven (5-7) years relevant programming experience, undergraduate degree in computer science, business or equivalent combination of education and experience. Proficiency in .NET/C# development (+5 years) .NET/C# full stack developer experience (+3 years) necessary Utilizes established development tools, guidelines and conventions including but not limited to ASP.NET, SQL Server, RabbitMQ, and REST APIs Strong front end experience with JavaScript, jQuery, HTML, CSS Designs, codes and tests new Windows and web software applications. Enhances existing systems by analyzing business objectives, preparing an action plan and identifying areas for modification and improvement. Investigates and develops skills in new technologies. Creates technical specifications and test plans. Understanding of troubleshooting techniques. Object-oriented design experience. Domain driven design preferred. Proficient understanding of code versioning tools such as Git, GitHub, SVN, other tools for Agile SCRUM Sprint scheduling and issue tracking such as Atlassian JIRA and Confluence. Excellent verbal and written communications skills. SALARY & BENEFITS: $125,000-$145,000 annually Medical, Dental, and Vision 401(k) with Company Match Sick and Vacation Days Flexible Spending Account Life & Disability Insurance Education Assistance Employee Referral Program Career-minded individuals will find our business challenging and our reputation for excellence just one of the rewards we have to offer. To further enhance this tradition of excellence, our employees participate in continuous training and development programs in a variety of disciplines. Join me on LINKED IN: LinkedIn.com/in/DianeKrehbiel Southern California LEADERSHIP JOBS on Linked In : Diane Krehbiel Executive & Technology Recruiting (54) Diane Krehbiel Executive and Technology Recruiting aka DKKD Staffing (Westlake Village, Ca) | Groups | LinkedIn Newsletter for Tips, Leadership on the market & more: https://conta.cc/3BfoyAS #IND123 IND123 Tagged as: .Net, Developer, Programmer About DKKD Staffing We build teams from CIO to Helpdesk, including HR across US"
"Full Stack Developer, Full time Hybrid W2 - Medical, Dental, 401k",Not available,Not available,https://www.indeed.com/pagead/clk?mo=r&ad=-6NYlbfkN0D5HFEsxTymhjKBzfSvtiFokOl3BWilSgrxQz1I-_WAt5BKZ_9_S9j-YQqZPfX-W2NAzGdzjG8s5_Z7Bj-VHlMnPeR9mfK2brAGu3iwkpN5kIsrUtSg7NzmbIGOXyCGnK8zSdOOSFggtCwGH5xI8q-M5CaB1G_dbm-6pcVTk6n1mlVq4i4-2yA2GKTHD27Nhr-EKZm0Qh9wgi8ptdHKlcctpvZS8tu4jjBAy4TR3cQcR3xDUqCIn7GbLFD-8f9lNkkIHS9YlKCl38BajYZzE4X4YR6G_AiOLmmLr_UhEw2s3DKs9XDFeIdjn4huLqSHFqYuveKPo1hfbqOryvMdoLvt1iMhPDizcEVwe1y72WegG1gxcJlOXkmLe-kBkpELPcrQNAfGVSd3P2l1URCjAoXIqHKaeJQJOvSddRoc9DAYvxPEBo99UA2iYRKcbejEzXQ43T6x4cS4A6jBOW6ExONIE8yN0QMask5maI1bc6nSCR4C0Fr2NiuGnPI4lXHiZpcqQRQbiakAls4Gstm6w9ECKjuNJNfK3OK9jWxPHBPkwkBEPeODy78ix9ro2tnxkPuECfGXWwxOw4eMDvRX5CX7dv-gE9n9FmOEtQddTpuUFpRyFC937oBNhWgLQt6tvZJvqOsS5M5j9wTYulJT6REB9TQ2c7fQwmv1uyCHZuPxLZKOJG9WtvFAT_wnX5H-epjguMdpJaQuKYLwgmuRrvnjO6cGS-LbBcsuwAm3Y2XboPbFNHAd1jzY&xkcb=SoDw6_M3q9qcjzygDZ0WbzkdCdPP&camk=ethIe0s0hecQzea-rjbahg==&p=4&fvj=0&vjs=3,,"Company Overview 'National Auto Loan Network (NALN) has been dedicated to providing trustworthy auto financing solutions during challenging economic times. Our mission is to empower consumers with confidence in their financing options, ensuring a seamless and reliable process.' Summary 'We are seeking a talented Full Stack Developer to join our team in the US. This role is crucial in developing innovative web applications that enhance our auto loan services and improve customer experience. Based at our US location, you will contribute to our mission of building trust and confidence in auto financing.' 'Responsibilities' ' Develop and maintain scalable web applications using modern frameworks. Collaborate with cross-functional teams to design robust APIs. Implement front-end features with a focus on user experience. Optimize application performance and ensure security best practices. Participate in Agile development cycles and code reviews. Manage version control using Git or GitHub. Support deployment processes on cloud platforms like Azure. Continuously improve existing systems based on user feedback and technological advancements.' 'Qualifications' ' Proven experience as a Full Stack Developer or similar role. Strong proficiency in JavaScript, Ruby on Rails, and front-end frameworks like React. * Experience with cloud services such as AWS or Azure. Familiarity with RESTful API design and integration. Knowledge of databases including MySQL and SQL Server. Ability to work effectively in Agile teams. Excellent problem-solving skills and attention to detail. Bachelor’s degree in Computer Science, Information Technology, or related field.' Pay: $80,000.00 - $100,000.00 per year Benefits: 401(k) matching Health insurance Life insurance Vision insurance Work Location: In person"
