job_title,company_name,company_location,job_link,match_score,job_description
Software Developer Senior Advisor,Not available,Not available,https://www.indeed.com/pagead/clk?mo=r&ad=-6NYlbfkN0BhqVrX-svuGvnOwDCbLuWyHKCvOdi7zuucDd7LUToWUNiAPfcsaCwzPudU1ZsA0zL9Du6ruTAnV4I9Sm1-RRGbyrhgk4tF8mq80NAAV3X-faz1glf4kTj_5pYYb4NsrYWcaI8K4sthB0rPOooVhs1sgUUiivM0qFYbHWeG8lDqqjhMmSbanPJoDlM_7Dzw-zOc1HfyM5V4GNsb-ewTWIIe4htc41xD8l4APna-In__vRyypNtqmCVUqOLGdOoRTlluOA5-IbJQjTkSHf4Kn_SEtlikKwH3cnjWoiH16U_dELQt0ezeCLhTSRhUiqTFIhGqoqcOgQvp74X90ZgZo_DVDM5rtxoCqmEho_rBMl4qjGlIIOI4KISUY2qFq8eDjrOLUCzmTwKOOKXzdkr-gb0lvbfiHiq--kTOxLdbe-3pPfNbqzE3TIUC_gEk7xFIXj72OeusYFYIzxfCGKZlbny45ACBpmJ2E2KNaUyh2fvLFy9uu6TcAFiCzcEdmw7jC0e0mmTAuLH5ljt5xNy0gTdp6pNEzEEG61rjUGpHPl0BPykAzQfrua5laBqieOlKpYr5Y7Q7zF7Z63eLv63m0vRxj8nMXEx8zkH72Y-cqskCpPQYa_03Sfq0_oowcnBC1O66hvJytGtaO4XAjGgRtV1kwYEtFGIMoGYdKgnJyDnZVbzIwMYXfd8x3MI9EM3icbkAO7M47g9AxTtGdv-SOkFvBCtSx4_aTS7NkhoD1CoqRDLl2wvPIpyYGdxY_Q4lDdMYq_L2h1ncHR5c7kZjn34OJcJ-VPHxCA8FhTfEMcso9Q==&xkcb=SoBt6_M3q9qcjzygDZ0VbzkdCdPP&camk=UoKtGZLa3XKlBuKI-qbdLQ==&p=5&fvj=0&vjs=3,,"Type of Requisition: Pipeline Clearance Level Must Currently Possess: Secret Clearance Level Must Be Able to Obtain: Secret Public Trust/Other Required: None Job Family: Software Engineering Job Qualifications: Skills: Application Development, Software Development, Software Development Life Cycle (SDLC) Certifications: None Experience: 8 + years of related experience US Citizenship Required: Yes Job Description: Software Developer Sr Advisor Deliver simple solutions to complex problems as a Software Developer Sr Advisor at GDIT. Here, you’ll tailor cutting-edge solutions to the unique requirements of our clients. With a career in application development, you’ll make the end user’s experience your priority and we’ll make your career growth ours. At GDIT, people are our differentiator. As a Software Developer Sr Advisor you will help ensure today is safe and tomorrow is smarter. Our work depends on Software Developer Sr Advisor joining our team to support the NAWCWD mission at Naval Base Ventura County, Point Mugu. HOW A SOFTWARE DEVELOPER SR ADVISOR WILL MAKE AN IMPACT Design, develop, document, test, integrate, and modify software for database systems and integration of those systems with airborne electronic warfare systems Develop, create, troubleshoot, and modify specialized utility programs and applications in support of real-time systems Perform hardware and software development planning in the incorporation of modifications into aviation systems Study information needs; conferring with users; study systems flow, data usage, and work processes; investigate problem areas; follow the software development lifecycle Determine operational feasibility by evaluating analysis, problem definition, requirements, solution development, and proposed solutions Document and demonstrate solutions by developing documentation, flowcharts, layouts, diagrams, charts, code comments and clear code Help to lead and mentor other software engineers and developers to perform and assist in their duties as required. WHAT YOU’LL NEED TO SUCCEED: Education: BS or equivalent experience in a STEM field. Required Experience: 8+ years of related experience. Required Technical Skills: software development, systems integration, engineering management Security Clearance Level: DoD Secret Clearance Required Skills and Abilities: Agile Framework, Scrum Master, collaborative teamwork, communication up/down Preferred Skills: Naval Aviation electronic intelligence systems knowledge, database development/administration. Location: On Customer Site US Citizenship Required GDIT IS YOUR PLACE: 401K with company match Comprehensive health and wellness packages Internal mobility team dedicated to helping you own your career Professional growth opportunities including paid education and certifications Cutting-edge technology you can learn from Rest and recharge with paid vacation and holidays The likely salary range for this position is $144,410 - $195,378. This is not, however, a guarantee of compensation or salary. Rather, salary will be set based on experience, geographic location and possibly contractual requirements and could fall outside of this range. Scheduled Weekly Hours: 40 Travel Required: Less than 10% Telecommuting Options: Onsite Work Location: USA CA Point Mugu Additional Work Locations: Total Rewards at GDIT: Our benefits package for all US-based employees includes a variety of medical plan options, some with Health Savings Accounts, dental plan options, a vision plan, and a 401(k) plan offering the ability to contribute both pre and post-tax dollars up to the IRS annual limits and receive a company match. To encourage work/life balance, GDIT offers employees full flex work weeks where possible and a variety of paid time off plans, including vacation, sick and personal time, holidays, paid parental, military, bereavement and jury duty leave. To ensure our employees are able to protect their income, other offerings such as short and long-term disability benefits, life, accidental death and dismemberment, personal accident, critical illness and business travel and accident insurance are provided or available. We regularly review our Total Rewards package to ensure our offerings are competitive and reflect what our employees have told us they value most. We are GDIT. A global technology and professional services company that delivers consulting, technology and mission services to every major agency across the U.S. government, defense and intelligence community. Our 30,000 experts extract the power of technology to create immediate value and deliver solutions at the edge of innovation. We operate across 50 countries worldwide, offering leading capabilities in digital modernization, AI/ML, Cloud, Cyber and application development. Together with our clients, we strive to create a safer, smarter world by harnessing the power of deep expertise and advanced technology. Join our Talent Community to stay up to date on our career opportunities and events at gdit.com/tc . Equal Opportunity Employer / Individuals with Disabilities / Protected Veterans"
Infor Syteline Developer,Not available,Not available,https://www.indeed.com/pagead/clk?mo=r&ad=-6NYlbfkN0BnrauatYeMwg4i92TryNjUW6jIumJtj8h3_u4uUAQFXjeA2If_4ybSAf5kYx32pYl6ectOEdFQdhUdeu5i17aq8Mv1jC2lZ1mxk-Bgn_3BEBUvv4jsqD1IJeZDpyB7_gcdUXVy-B-es6ghv-AKvC-JNrMcXE-3zH2WZNku6LsIo8tXkS777lPafqtHG2nVjgAb3sbTz6SO2zDmTdrLPfmsc1IWDpmtQy5SzIOBdc7YmnXaNF9IggwCcnpsqDvxHqkGN7dJstDLX2pKVfF80Q3aSqWK7ovN1X5pMVTiB1ru02ddi2kj1cDHxvvfinbfp9q6tBAwJfq02ImXaZzOG3Uo9E3T-srRdt6ZHHTQgfUqHGXKZWtApbJzz0fXZcrLxh-Uier6Gx9CCssB71NCXuM1Kh-NidQTNkuhxTi2hkQDSQSmEDSJiNZz-afAKzKgg1KXxR22CzNTcM_WsfHQdK4XWDLnFCsWUbObKwTJYtddX9Lj6js5pWkBFYht62-HIT3ugVHO8_xNtcz_BHm-iNNTlZ9w1wm4FpLpNVKVe3gATU-eG3lrVHsomOof2egHoqD18InyiMu1b3lgYSQ0fQqjvgDsSCuKRrUwazZ_GyP-qbf4-2otnS8Dounj9Nj28rwIwfz-GGbVRrmJC9vJS9o6WdUWHIupTs65oDnkSt3mGdj9KT562M5j6zgtynq51uOP2rjE2crFA2164Rmyt25jBom8WfdAnCLITf4VR72f_mAuuF5lrpd98MK1jTU6RsvIbEOycGUxVWrsuagXw3kjc3cxm1jz_GfgoILREiYb2MBAgp6olKsoxVD-vsL0OHXNd-dCp7Xhz1-JwaJA_U1hjHLJDKsGL5ki8GGkgRaX4gwZGIwxn328SFkNzM_Al22fCeeSbfNtlI_Fwcy1sJhl&xkcb=SoDZ6_M3q9qcjzygDZ0UbzkdCdPP&camk=nUmJqO2E8rgeXMUmb0MlQQ==&p=6&fvj=0&vjs=3,,"The Infor Syteline Developer will analyze complex business requirements and concert them into effective technical solutions, while collaborating closely with functional teams to ensure smooth business operations. ESSENTIAL FUNCTIONS : Design, develop, customize, and enhance Infor Syteline Cloudsuite Industrial 10 applications. Create and manage Infor Mongoose forms for improved user interfaces and functionality. Integrate Syteline with external systems using Infor OS APIs and automate business decision-making. Develop scripts to automate tasks and enhance system efficiency. Use Birst to design and maintain advanced reports and dashboards that support business decision-making. Create and optimize BQL queries for sophisticated reporting and data extraction. Provide ongoing support for production environments by troubleshooting and implementing fixes. Collaborate with functional and technical teams to understand business requirements and deliver effective technical solutions. Participate in code reviews to ensure adherence to best practices and proper documentation. Ensure system security, performance, and scalability in line with organizational goals. In-office work 5 days a week at the assigned branch office. English speaking during an emergency and while performing job duties where there is potential for an emergency. This does not apply to casual conversations between employees while not performing a job duty. KNOWLEDGE : Bachelor’s Degree in Computer Science, Software Engineering, or a related field, or equivalent experience. 1-2 years of experience with CloudSuite Industrial (Syteline) Experience with MS.Net Framework, Visual Studio (C#), and multi-tier architecture. Ability to design and implement databases and SQL-based software solutions. Experience in troubleshooting programming changes and modifications. Ability to develop Business Intelligence solutions. Familiarity with relational databases such as MySQL, Oracle, and SQL Server. Experience developing business reports using tools such as SQL, Crystal Reports, and SSRS. Excellent written and verbal communication skills, especially in explaining technical requirements and solutions to clients. SKILLS : Proven experience as an Infor Syteline Cloudsuite Industrial 10 Developer. Strong expertise in Infor Mongoose, particularly in the development and customization of forms. Experience with Infor OS APIs for system integration and automation. Proficiency in scripting within the Infor Cloudsuite environment. Demonstrated experience in using Birst for reporting and dashboard creation. Solid knowledge of BQL (Business Query Language) for complex queries and reporting. Ability to translate business processes into technical solutions. Strong troubleshooting, problem-solving, and analytical skills. Excellent communication and collaboration skills, with the ability to work effectively within a team. Experience with Mongoose and SQL is a bonus. Familiarity with .NET Framework and ASP a plus. PAY RANGE: $110,000.00-$130,000.00 WORK ENVIORNMENT: On site, La Mirada, CA REPORTING RELATIONSHIP : IT Executive General Manager MENTAL ABILITIES : Ability to work harmoniously with others. Ability to accept and follow instructions. Ability to maintain a positive attitude. Ability to work with minimal supervision. WORKING CONDITIONS : LIFTING: Average Weight: 25 lb. Frequency: Daily Equal Opportunity Employer/Protected Veterans/Individuals with Disabilities This employer is required to notify all applicants of their rights pursuant to federal employment laws. For further information, please review the Know Your Rights notice from the Department of Labor."
Software Engineer,Not available,Not available,https://www.indeed.com/pagead/clk?mo=r&ad=-6NYlbfkN0DOvu5-6G99cU4RhhrQ10d3yDS98AmRF8iPFJNCVm0RTKGcvf8yiW7JU1lO6XljkYJ3cPz13UrD-J8Img-pg4eL-yU-PTv8aKj1UqXLSUV-8H6tR1h1BTMPXFvvIwfojl4ACb0xTO5DtaBSMU1HiA9B5kq01XQOeOtmIejEuXDLoWAJe9EGqxGNHBrYgsFzzvubA_70BpyzVsY3iCLXL4x1gFCQbP34C_k3mOMuCqdfv7oMX0NdjEJxtOAxzzaOYatXl4ge8CXsVYKhIn9qPNucyv3aJmvfsUKCTqkfFO-1OFLaL8w9hNgUJdVlKPW2UFoaC_gZW4ciKlVXzSrsiGEoBiYsA07QOc8ZKRzcHOIhcjobc95YsdOjtgkdRijaacCLpEsZYUkHkiglMNwxh0YDVgLYi85U_fE2ZohkIqgN_nmePYYAgNUyc7Khryg3u9oYc_Q6EBSxWihLBtZZ9Qh3s5z4-08zWhxLzAeFxwQmFew2kuVE6Cw6lJYWe8u06_MBRvani4EhMATpN53vKKr8DwYidVYiAK0wXlD-frjxSIvw3YhgYQ4DPITSbg1GPflDYepv96fUkpCEFC99k87FhGgvRXRqilcSr1PKGc-RSVPTL4HoS4F2pclf4zUp_kTQRWutiE-oNZ9DglpI7C6cgzQ1Yr9Y4JQ=&xkcb=SoBi6_M3q9qcjzygDZ0rbzkdCdPP&camk=ethIe0s0hee_QuKtNZhioQ==&p=7&fvj=0&vjs=3,,"Software Engineer Must be U.S. citizen due to U.S. Government contract requirements. Must be eligible to obtain and maintain a DoD Secret clearance. Active clearance preferred. Arkham Technology is a leader in cutting-edge engineering solutions, providing advanced technologies to support mission-critical applications. Our team is dedicated to delivering innovative and reliable solutions to meet the complex challenges of modern defense and commercial industries. Position Overview: Arkham Technology is seeking an Embedded Software Engineer with expertise in embedded systems and software development to play a crucial role in leading the development and implementation of embedded software solutions for our company's products. You will provide technical guidance and ensure the successful delivery of high-quality embedded software solutions. Key Responsibilities: · Design, code, test, integrate and document firmware and software for embedded systems and communication products · Support software engineering activities including interface design, system integration, code reviews, and software testing · Participate in internal review of software components and systems. · Create required project documentation in support of contract deliverables. Including development plans, requirement and design specifications, and test documents. · Develop embedded software for network security applications, including device management software, communication protocols, device drivers, and control plane security features. · Collaborate with cross-functional teams to integrate software and hardware solutions. · Manage requirements, including decomposition, allocation, verification, and validation Required Qualifications · Bachelor’s degree in Engineering, Computer Science, or a related field. · 4+ years of experience in embedded systems design · High proficiency in embedded C/C++ or equivalent systems language · Broad spectrum of knowledge to be able to understand end-to-end network system architecture from wireless physical layer all the way up to application end-point. · Understanding of MAC and Networking layer of a communication system. · Deep understanding of Internet Protocol Security (IPsec), network protocols, data authentication and encryption (e.g. TLS, SSL, encryption, OpenSSL, X.509 Certificates, etc.) · Knowledge and experience of different security protocols and encryption algorithms such as suite of CNSA algorithms. · Experience with low-level hardware driver implementation · Experience with embedded Linux · Ability to work in a Bare Metal environment. · Familiarity with ARM architecture. · Strong problem-solving skills and ability to work in a collaborative team environment. · Excellent verbal and written communication skills. · U.S. Citizenship required; ability to obtain and maintain a security clearance. · Willing to travel periodically, as needed Desired Qualifications · Experience with systems, software and hardware development processes in DoD applications · Familiarity with DoD Protocols: Knowledge of dynamic discovery processes and security protocols used in DoD networks · Expertise in Cryptographic Technologies and Cross Domain Solutions · Familiarity with DoD Protocols: Knowledge of dynamic discovery processes and security protocols used in DoD networks · Proficiency in Cryptographic Modernization 2 Operational Management · Knowledge of NETCONF/RESTCONF and YANG modeling to enhance network management and operability. · Understanding of Cryptographic Key Management based on EKMS and KMI · Familiarity with architecture development and system modeling tools such as Cameo Systems Modeler · Knowledge of Networking and Interface technologies including Web services like RESTful and SOAP · Understanding of Security requirements to provide Authentication, integrity, and confidentiality services and implementation · Expertise in Public Key Infrastructure with trust chains, certificates, revocation checking, cert validation · Expertise in Cryptographic mechanisms such as SHA, HMAC, Elliptic Curve, and quantum resistance approaches · Understanding of Cryptographic Message Syntax (CMS) Job Type: Full-time Pay: $85,000.00 - $180,000.00 per year Benefits: 401(k) 401(k) matching Bereavement leave Dental insurance Disability insurance Employee assistance program Family leave Flextime Free fitness classes Free parking Gym membership Health insurance Life insurance Lunch & learns Paid holidays Parental leave Referral program Snacks provided Vision insurance Wellness program Schedule: 8 hour shift Application Question(s): How did you hear about this opportunity? (Indeed, LinkedIn, Flyers, or other) Have you worked with Secure Boot in any of your previous roles, particularly in the context of embedded systems or firmware security? Are you a US citizen? Work Location: In person"
Engineer Sr Staff - Software,Not available,Not available,https://www.indeed.com/pagead/clk?mo=r&ad=-6NYlbfkN0BhhPTkMcqOvTRdA-h51-3cb_EQtzgLWPapL0oBQFo7NfzaqjHvxnXJpmxCEbOX6JVHNQk3d-SF5ueEE36OdDytsxO5qcDclJeU8dH_XnefeN-sQMnH2WTAvhCXQJt397wHnXM_rr_lQq6ytunHv8iMrNBPiJo0cI5EebOvC9GAGphRSAioHlZXf94TrTR3lk3UbI3CNyFBMdpgQlMOhJvqM8iXnPgyYSx2CcaUP_-BZluLC5F7nwPExIs4xbIRHpOk_LdKACuKbFs3LTxeGV8i_cKAF28NFcsg_nUYvJzRc1kqitYYrUGQ-mmouHHXyakeCe7xu4ZQ9ahGSfYUbsUDXE47Nid8nKyHqliJXlt2GOT1a96FU4vsihVCrX4C7Tuf-6GrJ7BE2TFLIgg5yxKiY6FnKtskEgaPtvEVFABQwPUYW4Pz8vMcvasfCDVWd-KhV1AS9T-PbQlFDZhIHUxgOg1d8uFrY3u6IVxoMZv9Croh-OiCLYbjTY4xPiN6K1o0vR_cmLyuMR64peiUOWxpdMcSnUR6ItZbALJJoys2kSUUmRkhyHB_bmClPDWEyxkd7PpUsLrJKXtPSAsC00EdoezHLnXm4j7I05iMdOF0b8EsI7_9vpo5rN8jGP3rnS-NdxiQqDLtcca7fUsl-CyVufNW3INlEOKbrdWm9Y_qtQPLGvwRJO1WPawYmQsQO8XJdqErDlPJjY5cQybFeSwF34OdLN1F8AlnXm_GnCNuzlWcrcOoXCWUHlKFo35PTIwvm_UOxeEnjI7KwQn8d62o&xkcb=SoDW6_M3q9qcjzygDZ0qbzkdCdPP&camk=UoKtGZLa3XKtvunlbueG1Q==&p=8&fvj=0&vjs=3,,"Job descriptions may display in multiple languages based on your language selection. What we offer: At Magna, you can expect an engaging and dynamic environment where you can help to develop industry-leading automotive technologies. We invest in our employees, providing them with the support and resources they need to succeed. As a member of our global team, you can expect exciting, varied responsibilities as well as a wide range of development prospects. Because we believe that your career path should be as unique as you are. Group Summary: Transforming mobility. Making automotive technology that is smarter, cleaner, safer and lighter. That’s what we’re passionate about at Magna Electronics, and we do it by creating world-class Electronic systems. We are a premier supplier for the global automotive industry with full capabilities in design, development, testing and manufacturing of complex Electronic systems. Our name stands for quality, environmental consciousness, and safety. Innovation is what drives us and we drive innovation. Dream big and create the future of mobility at Magna Electronics. Job Responsibilities: The Sr. Staff Software Engineer for Thermal Camera is responsible for development of software for thermal imaging camera systems for ADAS and automotive applications. Must lead various aspects of software development relevant for Thermal Camera development such as GUI Interface for Thermal Camera for development purpose, thermal sensor calibration SW, image quality enhancement SW/ algorithms, SW traceability in server, and support testers used in production process. Responsibilities Review and analyze product requirements (includes requirements from customer and supplier) and decompose the requirements to the lowest component level engineering. Develop C++ engineering applications: Design and development of SW used in the testing and validation of infrared Cameras. Applications to be written in Visual C++using MFC and/or C# and run in windows 11 and Ubuntu environments. Expand image analysis capabilities of the existing application. Develop automated tests to exercise specific function and properties of the thermal camera. Write applications code using object oriented concepts and data structures. Revision control/ SW Configuration Mangement in TFS (Team Foundation Server). Generate new/ maintain existing installer package for deployment of all SW applications. Coordinate with users the deployment of new SW releases. Write and deliver test plan to validate new SW releases. Conduct problem solving with identified issues in various testing setups and respective products. Conduct risk analysis such as DFMEA/ DRBFM for complex camera systems. Provide technical interface and input to manufacturing, quality, purchasing, customer, and suppliers to achieve successful completion of component, product and system design objectives within time and cost constraints. Develop test methods, engineering reports, fixture/prototype designs and test execution support for product development. Education/ Qualifications BS Computer Science/computer Engineering or a related field 5+ years of Visual C++/C#, Object Oriented design (OOP)/development experience Experience with Visual Studio, multi-threading, MFC, Win32 API, synchronization, blocking mechanisms, and Real Time Operating Systems (RTOS) Hands-on working expertise with Windows, IDE, OO Frameworks Solid understanding of OOP principles and techniques, distributed computing architectures, error management, transactions and techniques Excellent organizational skills and in meeting schedules and deadlines Strong team player with fast learning capability, strong problem-solving skills and ability to multitask Experience 10+ years experience with complex thermal imaging camera systems. Highly knowledgeable in C/C++. Automotive industry design techniques such as FMEA, DFM, and DFSS. HW/SW Interfaces (HSIS) WINDOWS applications and familiarity with embedded applications Software Configuration Mangement Project scheduling and resource allocation Design of Experiments Strong technical skills in designing code, testing, and debugging Experience with PFMEA, DFMEA, Automotive Spice and ISO 26262 is a plus. Health and Safety Displays a positive attitude towards safety, works safely and follows all the Company's safety policies and procedures. (US) Complies with all Health, Safety and Environmental standards in accordance with the Magna Employee Charter, the Occupational Health & Safety Act, and the Michigan Occupational Health & Safety Act. (ONTARIO) Complies with all Health, Safety and Environmental standards in accordance with the Magna Employee Charter, and the Occupational Health & Safety Act. Ensures all employees and visitors have a safe environment in that safety and housekeeping standards are maintained; and all hazards, unsafe actions, or unsafe conditions have been identified, corrected, and/or eliminated. Responds to and investigates all reports of injuries, accidents, illnesses, near misses and property damage immediately. Takes an active part in the division’s safety program by performing regular workplace inspections, effectively investigates accidents/incidents promptly and assists in meeting or exceeding the division’s safety goals. Hiring Salary Range: $131,000- $196,000 ( Salary to be determined by the education, experience, knowledge, skills, and abilities of the applicant, internal equity, and alignment with market data ) Applicants must be currently authorized to work in the United States on a full-time basis. This position does not offer sponsorship for employment visa status now or in the future. #LI-Hybrid Awareness, Unity, Empowerment: At Magna, we believe that a diverse workforce is critical to our success. That’s why we are proud to be an equal opportunity employer. We hire on the basis of experience and qualifications, and in consideration of job requirements, regardless of, in particular, color, ancestry, religion, gender, origin, sexual orientation, age, citizenship, marital status, disability or gender identity. Magna takes the privacy of your personal information seriously. We discourage you from sending applications via email or traditional mail to comply with GDPR requirements and your local Data Privacy Law. Worker Type: Regular / Permanent Group: Magna Electronics"
